id,title,title_eng,location,latitude,longitude,culture,collection_date,collector,performer,source,source_key,source_author,source_title,source_publisher,source_address,source_page_num,source_song_num,source_date,catalogue_numberencoder,encoding_date,copyright,license_abbr,version,meter,metric_classification,modality,key,ambitus,has_lyrics,has_music,genre,language,language_iso,url,preview_url,path,format,checksum
NHSDiscography-056,Peyote song,,"North Dakota, USA",47.694974341862796,-102.3486328125,Pawnee,1936,,,"""Peyote song"" [Side 1, Track 3F]. On Music of the Pawnee [LP]. New York: Folkways Records (1967)",,,On Music of the Pawnee [LP],Folkways Records ,New York,,"Side 1, Track 3F",1967,,,,,,,,,,20,,,Healing,,,,,Transcriptions/xml_raw/NHSDiscography-056.xml,xml,b2ae2a0c196f70083a75f30129ab39bc
NHSDiscography-057,Dangkarrarnaka,,"Croker Island, West Arnhem, Northern Territory, Australia",-11.1764219,132.531345699999,Iwaidja,2004,,,"""Dangkarrarnaka"" [Track 28]. On Jurtbirrk: Love Songs From North Western Arnhem Land [CD]. Batchelor, Northern Territory, Australia: Batchelor Press (2005)",,,On Jurtbirrk: Love Songs From North Western Arnhem Land [CD],Batchelor Press ,"Batchelor, Northern Territory, Australia",,Track 28,2005,,,,,,,,,,10,,,Love,,,,,Transcriptions/xml_raw/NHSDiscography-057.xml,xml,7d56134dd90f6fa4c310bf48ccbef25f
NHSDiscography-058,Untitled Papua New Guinea love track.,,"Western Highlands Province, Papua New Guinea",-5.626812999999999,144.25931200000002,Melpa,pre-2011,,,"""Untitled Papua New Guinea love track."" Unpublished recording acquired from Don Niles (2011).",,,Unpublished recording acquired from Don Niles (2011),,,,,,,,,,,,,,,13,,,Love,,,,,Transcriptions/xml_raw/NHSDiscography-058.xml,xml,68b89bfbbcb3082a32897534f51c2330
NHSDiscography-059,Tapiti,,"Alto Izogog, Bolivia",-18.412974,-61.780545,Guarani,1991-1997,,,"""Tapiti"" [Track 46]. On Le chant des engants du monde: vol. 6 Amérique du Sud (CD). Paris, France: Arion (1998)",,,On Le chant des engants du monde: vol,Arion ,"6 Amérique du Sud (CD). Paris, France",,Track 46,1998,,,,,,,,,,5,,,Lullaby,,,,,Transcriptions/xml_raw/NHSDiscography-059.xml,xml,0e3fe888726720409a217208e0b934b6
NHSDiscography-060,Belian (slow) - Meratus,,"South Kalimantan, Indonesia",-3.0926415,115.28375849999901,Meratus,1997-1998,,,"""Belian (slow) - Meratus"" [Track 4]. On Bornéo: Music of the Dayak and of the Punan [CD]. Paris, France: Buda Musique (1999)",,,On Bornéo: Music of the Dayak and of the Punan [CD],Buda Musique ,"Paris, France",,Track 4,1999,,,,,,,,,,10,,,Healing,,,,,Transcriptions/xml_raw/NHSDiscography-060.xml,xml,b7363e5a90dde0b386ac06722573ab0d
NHSDiscography-061,Lama,,"Nyanza, Rwanda",-2.35,29.7333,Rwandans,1952,,,"""Lama"" [Side A, Track 2]. On TR-181: Sons d' Afrique (Rwanda) [LP]. Johannesburg: International Library of African Music (1952)",,,On TR-181: Sons d' Afrique (Rwanda) [LP],International Library of African Music ,Johannesburg,,"Side A, Track 2",1952,,,,,,,,,,17,,,Love,,,,,Transcriptions/xml_raw/NHSDiscography-061.xml,xml,a7fc247f11d540dba3ac15523877909d
NHSDiscography-062,Ihumke,,"Nibutani, Hokkaido, Japan",42.6358,142.1595,Ainu,1978,,,"""Ihumke"" [Track 14]. On Ainu Songs Chants des Ainou [CD]. France: Auvidis (1993)",,,On Ainu Songs Chants des Ainou [CD],Auvidis ,France,,Track 14,1993,,,,,,,,,,12,,,Lullaby,,,,,Transcriptions/xml_raw/NHSDiscography-062.xml,xml,9b544b32801c5272ed9eb4851a2ca7a0
NHSDiscography-063,Embrukoi,,"Arusha Baraza, Arusha district, Tanzania",-3.3667,36.6833,Maasai,1950,,,"""Embrukoi"" [Track 20]. Tanzania Vocals Tanganyika [CD]. Utrecht, Netherlands: SWP Records; Grahamstown, South Africa: International Library of African Music (2003)",,,Tanzania Vocals Tanganyika [CD],"SWP Records; Grahamstown, South Africa: International Library of African Music ","Utrecht, Netherlands",,Track 20,2003,,,,,,,,,,30,,,Dance,,,,,Transcriptions/xml_raw/NHSDiscography-063.xml,xml,fb964c8752fdee895d212eee3c680df6
NHSDiscography-064,"Changgunrŏi: Pyŏlsanggŏri, Sinjanggŏri, Taegamgŏri, T'ŏjudaegamgŏri",,"Seoul, South Korea",37.5665,126.978,Korea,1991,,,"""Changgunrŏi: Pyŏlsanggŏri, Sinjanggŏri, Taegamgŏri, T'ŏjudaegamgŏri"" [Disc 2, Track 7]. On Seoul Jaesu Kut & Kin'ogwi Kut [CD]. Seoul: National Center for Korean Traditional Performing Arts/Korean Broadcasting System (1997)",,,On Seoul Jaesu Kut & Kin'ogwi Kut [CD],National Center for Korean Traditional Performing Arts/Korean Broadcasting System ,Seoul,,"Disc 2, Track 7",1997,,,,,,,,,,17,,,Healing,,,,,Transcriptions/xml_raw/NHSDiscography-064.xml,xml,a72c214ce542538a295f2e630178e5c6
NHSDiscography-065,Ngimthanda nje muhle,,"Mahlabatini, KwaZulu-Natal, South Africa",-28.2242365,31.4627576,Zulu,1955,,,"""Ngimthanda nje muhle"" [Side B, Track 1] On The Zulu Songs of Princess Constance Magogo KaDinuzulu [LP]. Johannesburg: Gallo Records (1973)",,,On The Zulu Songs of Princess Constance Magogo KaDinuzulu [LP],Gallo Records ,Johannesburg,,"Side B, Track 1",1973,,,,,,,,,,26,,,Love,,,,,Transcriptions/xml_raw/NHSDiscography-065.xml,xml,d2a1dd66658b7bf3f81e2d939045bf34
NHSDiscography-066,Porkâni (Zekre Khanjar),,"Turkmen Sahra, Iran",37.256692799999996,55.1694594,Turkmen,1972-1977,,,"""Porkâni (Zekre Khanjar)"" [Disc 3, Track 5]. On Hasht Behesht : A Selection of Iranian Regional Music [CD]. Tehran, Iran: Mahoor Institute of Culture and Art (2005)",,,On Hasht Behesht : A Selection of Iranian Regional Music [CD],Mahoor Institute of Culture and Art ,"Tehran, Iran",,"Disc 3, Track 5",2005,,,,,,,,,,24,,,Healing,,,,,Transcriptions/xml_raw/NHSDiscography-066.xml,xml,fcb6b42ffbb79addee32db57c22077e4
NHSDiscography-067,Berceuse / Lullaby,,"Chukotka Autonomous Okrug, Russia",65.6298355,171.6952159,Chukchee,pre-1997,,,"""Berceuse / Lullaby"" [Track 22]. On Russian Far North: The Chukchi [CD]. Boulogne, France: Auvidis (1997)",,,On Russian Far North: The Chukchi [CD],Auvidis ,"Boulogne, France",,Track 22,1997,,,,,,,,,,7,,,Lullaby,,,,,Transcriptions/xml_raw/NHSDiscography-067.xml,xml,06e247d34f2c5fe41fdfb08bba3dc27f
NHSDiscography-068,Musahowelele likishi la Mulena,,"Wuaskile Compound, Nkana Mine NR, Zambia",-12.830995,28.196626000000002,Lozi,1949,,,"""Musahowelele likishi la Mulena"" [Tape 72]. On C3X-10 [Acetate record]. Johannesburg, South Africa: International Library of African Music (1949)",,,On C3X-10 [Acetate record],International Library of African Music ,"Johannesburg, South Africa",,Tape 72,1949,,,,,,,,,,27,,,Dance,,,,,Transcriptions/xml_raw/NHSDiscography-068.xml,xml,3b26d6f9db07c859ff32e5b06c17fa60
NHSDiscography-069,Canción de amor (canto de entretenimiento),,"San Sebastián, Mexico",20.7618,-104.852,Huichol,1898,,,"""Canción de amor (canto de entretenimiento)"" [Track 14]. On Música y Cantos para la Luz y los Ocuridad: 100 años de Testimonios de los Pueblos Indígenas: Música y Cantos Huicholes Grabados por Carl Lumholtz [CD]. Mexico: Comisión para el Desarrollo de los Pueblos Indígenas (2005)",,,On Música y Cantos para la Luz y los Ocuridad: 100 años de Testimonios de los Pueblos Indígenas: Música y Cantos Huicholes Grabados por Carl Lumholtz [CD],Comisión para el Desarrollo de los Pueblos Indígenas ,Mexico,,Track 14,2005,,,,,,,,,,17,,,Love,,,,,Transcriptions/xml_raw/NHSDiscography-069.xml,xml,66631b0f52e1bcadb233aeb482296aba
NHSDiscography-070,Deux berceuses de l'Ile des Pins,,"Vao, New Caledonia",-22.67,167.5,Kanaks,1984,,,"""Deux berceuses de l'Ile des Pins"" [Track 15]. On Chants Kanaks [CD]. Arles, France: Harmonia Mundi (1990)",,,On Chants Kanaks [CD],Harmonia Mundi ,"Arles, France",,Track 15,1990,,,,,,,,,,7,,,Lullaby,,,,,Transcriptions/xml_raw/NHSDiscography-070.xml,xml,3c7504d819d57186b2346ebf98ffeb92
NHSDiscography-071,Lullaby,,"Leros, Greece",37.16,26.84,Greeks,1998,,,"""Lullaby"" [Disc 1, Track 6]. On Tēs Leros Ta Tragoudia [CD]. Leros, Greece: Music Folklore Archive (1998)",,,On Tēs Leros Ta Tragoudia [CD],Music Folklore Archive ,"Leros, Greece",,"Disc 1, Track 6",1998,,,,,,,,,,9,,,Lullaby,,,,,Transcriptions/xml_raw/NHSDiscography-071.xml,xml,443970b2adb796cc7dea0fda7a9b1bdd
NHSDiscography-072,Tsimshian blanket dance song,,"Yakutat, Alaska, USA",59.5469,-139.7272,Tlingit,pre-1981,,,"""Tsimshian blanket dance song"" [Side 2, Track 4]. On Southeast Alaska Folk Tradition, Vol. 1: Exploration and Discovery, 1786-1897 [LP]. New York: Folkways Records (1981)",,,"On Southeast Alaska Folk Tradition, Vol","Exploration and Discovery, 1786-1897 [LP]. New York: Folkways Records ",1,,"Side 2, Track 4",1981,,,,,,,,,,12,,,Dance,,,,,Transcriptions/xml_raw/NHSDiscography-072.xml,xml,bbb3dc6074d273d24872f2dec2bb8d9a
NHSDiscography-073,Lullaby,,"Timbuktu, Mali",16.7758,-3.0094,Tuareg,pre-1939,,,"""Lullaby"" [Track 6, Song 3]. On African Music [LP]. New York: Folkways Records (1957)",,,On African Music [LP],Folkways Records ,New York,,"Track 6, Song 3",1957,,,,,,,,,,9,,,Lullaby,,,,,Transcriptions/xml_raw/NHSDiscography-073.xml,xml,8fd4d5e34bc00e64beeb8934810ee5aa
NHSDiscography-074,Canto de amor,,"Morelos and Guerrero, Mexico",18.238,-99.2305,Nahua,1962-1968,,,"""Canto de amor"" [Track 2]. On In Xóchitl in Cuícatl [CD]. Mexico City: Instituto Nacional de Antropología e Historia (2002)",,,On In Xóchitl in Cuícatl [CD],Instituto Nacional de Antropología e Historia ,Mexico City,,Track 2,2002,,,,,,,,,,12,,,Love,,,,,Transcriptions/xml_raw/NHSDiscography-074.xml,xml,bb9c214eba3ce90a50e79dc74642bd90
NHSDiscography-075,Little woman doctor song,,"British Columbia, Canada",54.0,-125.0,Kwakwaka'wakw,1947-1953,,,"""Little woman doctor song"" [Side 3, Track 6]. On Indian Music of the Pacific Northwest Coast [LP]. New York: Folkways Records (1967)",,,On Indian Music of the Pacific Northwest Coast [LP],Folkways Records ,New York,,"Side 3, Track 6",1967,,,,,,,,,,10,,,Healing,,,,,Transcriptions/xml_raw/NHSDiscography-075.xml,xml,15054c59bbbf0f4a4ba76ff4fb9dc18b
NHSDiscography-076,"Tolema, tolema-ey",,"Nakua, Nyangatom, South Omo Zone, Ethiopia",4.58,35.49,Nyangatom,2012,,,"""Tolema, tolema-ey"". Unpublished recording acquired from Hannah Wild (2012).",,,Unpublished recording acquired from Hannah Wild (2012),,,,,,,,,,,,,,,15,,,Lullaby,,,,,Transcriptions/xml_raw/NHSDiscography-076.xml,xml,914ddb6db8f16dfb85f1cd03ffa661ad
NHSDiscography-077,Lovers' song,,"Punta Arenas, Chile",-53.1638,-70.9171,Alacaluf,1996,,,"""Lovers' song"" [Track ALC001R001]. On AILLA's South American Languages Collection [Audio]. Austin: www.ailla.utexas.org (2006)",,,On AILLA's South American Languages Collection [Audio],www.ailla.utexas.org ,Austin,,Track ALC001R001,2006,,,,,,,,,,10,,,Love,,,,,Transcriptions/xml_raw/NHSDiscography-077.xml,xml,fab1de506e766a8693bac3d92ea50027
NHSDiscography-078,Festive song,,"Esmeraldas, Ecuador",0.95,-79.66670000000002,Chachi,pre-1986,,,"""Festive song"" [Track 6]. On Lowland Tribes of Ecuador [CD]. New York: Smithsonian Folkways Recordings (2001)",,,On Lowland Tribes of Ecuador [CD],Smithsonian Folkways Recordings ,New York,,Track 6,2001,,,,,,,,,,13,,,Dance,,,,,Transcriptions/xml_raw/NHSDiscography-078.xml,xml,d06cb35310ffb5aedc34fc920c744ce7
NHSDiscography-079,Men's standing dance,,"Lukaf, Pulap, Chuuk, Federated States of Micronesia",7.5381681999999905,149.421444,Chuuk,1984,,,"""Men's standing dance"" [Track 25]. On Spirit of Micronesia [CD]. Wotton-under-Edge, Gloucestershire, United Kingdom: Saydisc Records (1995)",,,On Spirit of Micronesia [CD],Saydisc Records ,"Wotton-under-Edge, Gloucestershire, United Kingdom",,Track 25,1995,,,,,,,,,,13,,,Dance,,,,,Transcriptions/xml_raw/NHSDiscography-079.xml,xml,24a1d2f2d5cbadc68519242effa9f554
NHSDiscography-080,Third song when treating the sick,,"Yuma Reservation, California, USA",32.784444,-114.645278,Quechan,1922,,,"""Third song when treating the sick"" [Track 8]. On Healing Songs of the American Indians [CD]. New York: Smithsonian Folkways Records (2000)",,,On Healing Songs of the American Indians [CD],Smithsonian Folkways Records ,New York,,Track 8,2000,,,,,,,,,,10,,,Healing,,,,,Transcriptions/xml_raw/NHSDiscography-080.xml,xml,7fa6671666bf7bc27c04b5d92109f90d
NHSDiscography-081,"Mele pule ho'ola no Hi'iaka, prayer chant for healing",,"Kalāhiki, South Kona, Hawaii, USA",19.3758333,-155.8986111,Hawaiians,1923-1933,,,"""Mele pule ho'ola no Hi'iaka, prayer chant for healing"" [Track 4]. On Na Leo Hawai'i Kahiko: Voices of Old Hawaii [CD]. Honolulu: Bernice P. Bishop Museum (1997)",,,On Na Leo Hawai'i Kahiko: Voices of Old Hawaii [CD],Bernice P. Bishop Museum ,Honolulu,,Track 4,1997,,,,,,,,,,5,,,Healing,,,,,Transcriptions/xml_raw/NHSDiscography-081.xml,xml,2cf05ab134da24d2a91dcc94b735cf65
NHSDiscography-082,Dance of Tiga: Uke cao naso,,"Tiga Island, Loyalty Islands, New Caledonia",-21.1,167.82,Kanaks,1986,,,"""Dance of Tiga: Uke cao naso"""" [Track 12]. On Chants Kanaks [CD]. Arles, France: Harmonia Mundi (1990)",,,On Chants Kanaks [CD],Harmonia Mundi ,"Arles, France",,Track 12,1990,,,,,,,,,,17,,,Dance,,,,,Transcriptions/xml_raw/NHSDiscography-082.xml,xml,27ead6828186b93c10ab26d682faf3c0
NHSDiscography-083,Sīdī bū ra's el-‘ajmī,,"Tunis, Tunisia",36.79,10.0,Tunisians,2009,,,"""Sīdī bū ra's el-‘ajmī"" [Track 4]. On Stambeli: Music, Trance, and Alterity in Tunisia [CD]. Chicago: University of Chicago Press (2010)",,,"On Stambeli: Music, Trance, and Alterity in Tunisia [CD]",University of Chicago Press ,Chicago,,Track 4,2010,,,,,,,,,,21,,,Healing,,,,,Transcriptions/xml_raw/NHSDiscography-083.xml,xml,7efe1401537d9209265822cfdfdf6998
NHSDiscography-084,Royne: Çî bû çit lê kirdim,,"Yekşawa, Iran",36.5802466014986,46.2826538085937,Kurds,1962,,,"""Royne: Çî bû çit lê kirdim"" [Side B, Track 5]. On Kurdish Folk Music from Western Iran [CD]. New York: Folkways Records (1966)",,,On Kurdish Folk Music from Western Iran [CD],Folkways Records ,New York,,"Side B, Track 5",1966,,,,,,,,,,7,,,Dance,,,,,Transcriptions/xml_raw/NHSDiscography-084.xml,xml,83ee3121cea4c33a148a81f2ba80be64
NHSDiscography-085,Shemonmuanaye,,"Amhara Region, Ethiopia",11.6608,37.9578,Amhara,1967,,,"""Shemonmuanaye"" [Side 2, Track 1]. On The Music of Ethiopia: Azmari Music of the Amharas [LP]. New York: Anthology Record and Tape Corporation (1969)",,,On The Music of Ethiopia: Azmari Music of the Amharas [LP],Anthology Record and Tape Corporation ,New York,,"Side 2, Track 1",1969,,,,,,,,,,16,,,Love,,,,,Transcriptions/xml_raw/NHSDiscography-085.xml,xml,f00d5320a8653fd2c6437173a222ba30
NHSDiscography-086,Micmac love song; Lenny Ward,,"Eel Ground, New Brunswick, Canada",46.967816,-65.6338448999999,Mi'kmaq,1911,,,"""Micmac love song; Lenny Ward"" [ATL 8861, Track 1.13]. On United States, Virginia and Maine; Canada, Quebec, New Brunswick, and Newfoundland; Various North American Indian Groups, 1909-1911 [Cylinder]. Bloomington, Indiana, USA: Indiana University Press (1979)",,,"On United States, Virginia and Maine; Canada, Quebec, New Brunswick, and Newfoundland; Various North American Indian Groups, 1909-1911 [Cylinder]",Indiana University Press ,"Bloomington, Indiana, USA",,"ATL 8861, Track 1.13",1979,,,,,,,,,,11,,,Love,,,,,Transcriptions/xml_raw/NHSDiscography-086.xml,xml,f1255413c2b8d800858e35eea6c19d0d
NHSDiscography-087,Lullaby song,,"Queen Charlotte Islands, British Columbia, Canada",51.922753,-129.9173008,Haida,1979,,,"""Lullaby song"" [Disc 2, Track 2]. On Haida: Indian Music of the Pacific Northwest [CD]. New York: Smithsonian Folkways Recordings (2001)",,,On Haida: Indian Music of the Pacific Northwest [CD],Smithsonian Folkways Recordings ,New York,,"Disc 2, Track 2",2001,,,,,,,,,,10,,,Lullaby,,,,,Transcriptions/xml_raw/NHSDiscography-087.xml,xml,d832ffb90b7f44128833057cf35cf1a0
NHSDiscography-088,Dance/chant ring of men,,"Gran Chaco, Argentina",-19.1622,-61.4702,Mataco,1974,,,"""Dance/chant ring of men"" [Track 5]. On Argentina: The Indians of the Gran Chaco [CD]. New York: Lyrichord Discs Inc (2005)",,,On Argentina: The Indians of the Gran Chaco [CD],Lyrichord Discs Inc ,New York,,Track 5,2005,,,,,,,,,,8,,,Dance,,,,,Transcriptions/xml_raw/NHSDiscography-088.xml,xml,5d89ee394f1a7cef5d32fcfa1d2fd9f0
NHSDiscography-089,Alesingo,,"Godo, Suriname",4.028273,-55.468726000000004,Saramaka,1977,,,"""Alesingo"" [Side 1, Track 3]. On From Slavery to Freedom: Music of the Saramaka Maroons, Suriname [LP]. New York: Lyrichord Discs . (1981)",,,"On From Slavery to Freedom: Music of the Saramaka Maroons, Suriname [LP]",Lyrichord Discs . ,New York,,"Side 1, Track 3",1981,,,,,,,,,,10,,,Dance,,,,,Transcriptions/xml_raw/NHSDiscography-089.xml,xml,b1d6d2b3a977d6743fa7d94013b6d86d
NHSDiscography-090,Urai turuk bilou,,"Madobag, South Siberut, Kepulauan Mentawai, West Sumatra, Indonesia",-1.5594179,99.03499769999992,Mentawaians,1992,,,"""Urai turuk bilou"" [Track 16]. On Music of Indonesia: Music from the Forests of Riau and Mentawai [CD]. Washington, D.C.: Smithsonian/Folkways Recordings (1995)",,,On Music of Indonesia: Music from the Forests of Riau and Mentawai [CD],Smithsonian/Folkways Recordings ,"Washington, D.C.",,Track 16,1995,,,,,,,,,,17,,,Dance,,,,,Transcriptions/xml_raw/NHSDiscography-090.xml,xml,e28116dd4d9cee0b21b51826951dd6ce
NHSDiscography-091,Agbadza,,"Anlo-Afiadenyigba, Volta Region, Ghana",6.03,0.99,Ewe,1997,,,"""Agbadza"" [Track 2]. On Ghana Rhythms of the People: Traditional Music and Dance of the Ewe, Dagbamba, Fante, and Ga People [CD]. Montpelier, Vermont, USA: Multicultural Media (2000)",,,"On Ghana Rhythms of the People: Traditional Music and Dance of the Ewe, Dagbamba, Fante, and Ga People [CD]",Multicultural Media ,"Montpelier, Vermont, USA",,Track 2,2000,,,,,,,,,,26,,,Dance,,,,,Transcriptions/xml_raw/NHSDiscography-091.xml,xml,305764f0e3e3f4ed3e5b53cac007e8a6
NHSDiscography-092,Nepali love song,,"Tukuche, Mid-Western Development Region, Nepal",28.776801799999998,83.570964,Thakali,1959,,,"""Nepali love song"" [Side 1, Track 1]. On Songs and Dances of Nepal [LP]. New York: Folkways Records (1964)",,,On Songs and Dances of Nepal [LP],Folkways Records ,New York,,"Side 1, Track 1",1964,,,,,,,,,,17,,,Love,,,,,Transcriptions/xml_raw/NHSDiscography-092.xml,xml,e934ffe912c716df495baf068b4ae074
NHSDiscography-093,Lullaby for a little boy,,"San Blas Islands, Panama",9.57,-78.81999999999998,Kuna,pre-1983,,,"""Lullaby for a little boy"" [Track 2]. On Music of the Indians of Panama: The Cuna (Tule) & Chocoe (Embera) Tribes [CD]. New York: Smithsonian Folkways Records (2001)",,,On Music of the Indians of Panama: The Cuna (Tule) & Chocoe (Embera) Tribes [CD],Smithsonian Folkways Records ,New York,,Track 2,2001,,,,,,,,,,7,,,Lullaby,,,,,Transcriptions/xml_raw/NHSDiscography-093.xml,xml,78b22a5c2ec4c0559bc64beb76cf76c4
NHSDiscography-094,Angi: Love song to a married woman,,"Truk Island, Caroline Islands, Federated States of Micronesia",7.418888899999991,151.731944399999,Chuuk,1907,,,,,,On The Demonstration Collection of E.M. von Hornbostel and the Berlin Phonogramm-Archiv [LP],Folkways Records,New York,,"Disc 1, Side B, Track 10",1963,,,,,,,,,,15,,,Love,,,,,Transcriptions/xml_raw/NHSDiscography-094.xml,xml,f7fb3259ebabc14face8f0783705faf4
NHSDiscography-095,Lullaby no. 45,,"Lake Fagnano, Argentina",-54.5568892,-67.7198118999999,Ona,1966,,,"""Lullaby no. 45"" [Disc 2, Track 29]. On Selk'nam Chants of Tierra del Fuego, Argentina Vol 1 [CD]. New York: Smithsonian/Folkways Recordings (2004)",,,"On Selk'nam Chants of Tierra del Fuego, Argentina Vol 1 [CD]",Smithsonian/Folkways Recordings ,New York,,"Disc 2, Track 29",2004,,,,,,,,,,7,,,Lullaby,,,,,Transcriptions/xml_raw/NHSDiscography-095.xml,xml,3166918690d0b273a73aed098ebee356
NHSDiscography-096,The approach of the thunderbirds,,"Waba cing, Minnesota, USA",48.16,-95.1,Ojibwa,1909,,,"""The approach of the thunderbirds"" [Track 1]. On Healing Songs of the American Indians [CD]. New York: Folkways Records (2000)",,,On Healing Songs of the American Indians [CD],Folkways Records ,New York,,Track 1,2000,,,,,,,,,,17,,,Healing,,,,,Transcriptions/xml_raw/NHSDiscography-096.xml,xml,3b49c2cc1e698bfe85e0ca1805610350
NHSDiscography-097,Omile mi un selo devojče (I fell in love with a girl in the village),,"Brza, Serbia",42.86,21.88,Serbs,1990,,,"""Omile mi un selo devojče (I fell in love with a girl in the village)"" [Track 27]. On Serbia: An Anthology of Serbian Folk Music [CD]. Lausanne, Switzerland: VDE-GALLO Records (1999)",,,On Serbia: An Anthology of Serbian Folk Music [CD],VDE-GALLO Records ,"Lausanne, Switzerland",,Track 27,1999,,,,,,,,,,9,,,Love,,,,,Transcriptions/xml_raw/NHSDiscography-097.xml,xml,ac114aa3cfb4196f193705b10fedd222
NHSDiscography-098,El bolonchón,,"Chiapas Highlands, Chiapas, Mexico",16.605,-92.64299999999999,Tzeltal,pre-1972,,,"""El bolonchón"" [Track 12]. On Música Indígena de los Altos de Chiapas [CD]. Mexico City: Instituto Nacional de Antropología e Historia (2002)",,,On Música Indígena de los Altos de Chiapas [CD],Instituto Nacional de Antropología e Historia ,Mexico City,,Track 12,2002,,,,,,,,,,8,,,Dance,,,,,Transcriptions/xml_raw/NHSDiscography-098.xml,xml,baad9240d3ced40fba195f9f41d1e688
NHSDiscography-099,Lullabies and aqausiit: Lullaby,,"Arctic Bay, Nunavut, Canada",73.0375749999999,-85.148031,Iglulik Inuit,1985,,,"""Lullabies and aqausiit: Lullaby"" [Track 37]. On Songs of the Inuit Iglulik [CD]. Barcelona: Witness (2004)",,,On Songs of the Inuit Iglulik [CD],Witness ,Barcelona,,Track 37,2004,,,,,,,,,,11,,,Lullaby,,,,,Transcriptions/xml_raw/NHSDiscography-099.xml,xml,4aa3fb20cebb185b854be05c80d6d279
NHSDiscography-100,Lullaby,,"Beyond the towns of Paucartambo and Ocongate, Cusco, Peru",-13.314010199999998,-71.5931656999999,Q'ero Quichua,1964,,,"""Lullaby"" [Track 32]. On Mountain Music of Peru [CD]. Washington, D.C.: Smithsonian Folkways Records (1991)",,,On Mountain Music of Peru [CD],Smithsonian Folkways Records ,"Washington, D.C.",,Track 32,1991,,,,,,,,,,7,,,Lullaby,,,,,Transcriptions/xml_raw/NHSDiscography-100.xml,xml,59f5f1fd8896d5f09872fdbb58464f6e
NHSDiscography-101,Iroqois lullaby,,"South side of St. Lawrence River, 10 miles west of Montreal, Canada",45.551845699999895,-73.72,Iroquois,.,,,"""Iroqois lullaby"" [Side 1, Track 2]. On Canada's Story in Song [LP]. New York: Folkways Records (1960)",,,On Canada's Story in Song [LP],Folkways Records ,New York,,"Side 1, Track 2",1960,,,,,,,,,,9,,,Lullaby,,,,,Transcriptions/xml_raw/NHSDiscography-101.xml,xml,81d689955eb2f72b29f414a5c7965d4d
NHSDiscography-102,Shamanic song with uŋtu drum,,"Lidoga, Russia",49.508201,136.914004,Nanai,1996,,,"""Shamanic song with uŋtu drum"" [Track 8]. On Chants Chamaniques et Quotidiens du Bassin de l'Amour [CD]. Paris: Buda Musique (1997)",,,On Chants Chamaniques et Quotidiens du Bassin de l'Amour [CD],Buda Musique ,Paris,,Track 8,1997,,,,,,,,,,12,,,Healing,,,,,Transcriptions/xml_raw/NHSDiscography-102.xml,xml,7fd619e966e5b3776190f1570c925b87
NHSDiscography-103,Puirt-a-beul,,"Outer Hebrides, United Kingdom ",57.62047,-7.33078,Highland Scots,pre-1952,,,"""Puirt-a-beul"" [Side 1, Track 3]. On Songs And Pipes of the Hebrides [LP]. New York: Folkways Records (1961)",,,On Songs And Pipes of the Hebrides [LP],Folkways Records ,New York,,"Side 1, Track 3",1961,,,,,,,,,,16,,,Dance,,,,,Transcriptions/xml_raw/NHSDiscography-103.xml,xml,5bd111fd2d4d3affd4e2ce9a34c07c23
NHSDiscography-104,Heyran,,"Indirgas, Iran",36.998165657002204,45.50537109375,Kurds,1962,,,"""Heyran"" [Side 2, Track 2]. On Kurdish Folk Music from Western Iran [LP]. New York: Folkways Records (1966)",,,On Kurdish Folk Music from Western Iran [LP],Folkways Records ,New York,,"Side 2, Track 2",1966,,,,,,,,,,7,,,Love,,,,,Transcriptions/xml_raw/NHSDiscography-104.xml,xml,e8152944adbd761190f55732f11bb340
NHSDiscography-105,Adtah ulus lagku ai-ai - kelabit,,"South Kalimantan, Indonesia",-3.0926415,115.28375849999901,Kelabit,1997-1998,,,"""Adtah ulus lagku ai-ai - kelabit"" [Track 11]. On Bornéo: Music of the Dayak and of the Punan [CD]. Paris: Buda Musique (1999)",,,On Bornéo: Music of the Dayak and of the Punan [CD],Buda Musique ,Paris,,Track 11,1999,,,,,,,,,,7,,,Love,,,,,Transcriptions/xml_raw/NHSDiscography-105.xml,xml,de0a92c6d6b80234aec84ea66a1563c8
NHSDiscography-106,La danse des coquillages / Shell dance,,"Chukotka Autonomous Okrug, Russia",65.6298355,171.6952159,Chukchee,pre-1997,,,"""La danse des coquillages / Shell dance"" [Track 1]. On Russian Far North: The Chukchi [CD]. Boulogne, France: PlayaSound (1997)",,,On Russian Far North: The Chukchi [CD],PlayaSound ,"Boulogne, France",,Track 1,1997,,,,,,,,,,7,,,Dance,,,,,Transcriptions/xml_raw/NHSDiscography-106.xml,xml,31b866301a0081e7d4aa7344bb2417da
NHSDiscography-107,Poisonous bites song,,"Gran Chaco, Argentina",-19.1622,-61.4702,Mataco,1974,,,"""Poisonous bites song"" [Track 14]. On Argentina: The Indians of the Gran Chaco [CD]. New York: Lyrichord Discs Inc (2005)",,,On Argentina: The Indians of the Gran Chaco [CD],Lyrichord Discs Inc ,New York,,Track 14,2005,,,,,,,,,,7,,,Healing,,,,,Transcriptions/xml_raw/NHSDiscography-107.xml,xml,b24d94b0b113c480fc5fa7d71caf9b18
NHSDiscography-108,Women's secret Yowalyu ceremonies,,Central and North-Central Australia,-25.0,135.0,Walbiri,1953,,,"""Women's secret Yowalyu ceremonies"" [Track 37A]. On Australian and New Guinea musical records (LP). Sydney, Australia: University of Sydney (1957)",,,On Australian and New Guinea musical records (LP),University of Sydney ,"Sydney, Australia",,Track 37A,1957,,,,,,,,,,21,,,Healing,,,,,Transcriptions/xml_raw/NHSDiscography-108.xml,xml,373b81f2352e2a0678c0f34216d96489
NHSDiscography-109,Canto 'de curación',,"Sierra Nevada de Santa Marta, Aracataca, Magdalena, Colombia",10.83,-73.69,Kogi,1971,,,"""Canto 'de curación'"" [Side 1, Track 7]. On Música Indígena y Folklórica de Colombia [LP]. Colombia: Importaciones Daro (1971)",,,On Música Indígena y Folklórica de Colombia [LP],Importaciones Daro ,Colombia,,"Side 1, Track 7",1971,,,,,,,,,,12,,,Healing,,,,,Transcriptions/xml_raw/NHSDiscography-109.xml,xml,0c627cfde5bf76694c96e70752a59175
