id,title,title_eng,location,latitude,longitude,culture,collection_date,collector,performer,source,source_key,source_author,source_title,source_publisher,source_address,source_page_num,source_song_num,source_date,catalogue_numberencoder,encoding_date,copyright,license_abbr,version,meter,metric_classification,modality,key,ambitus,has_lyrics,has_music,genre,language,language_iso,url,preview_url,path,format,checksum
NHSDiscography-110,Hoop dance song,,"Arizona, USA",34.0,-112.0,Hopi,1924,,,"""Hoop dance song"" [Track 14]. On Hopi Katcina Songs and Six Other Songs by Hopi Chanters [CD]. New York: Smithsonian Folkways Recordings (2001)",,,On Hopi Katcina Songs and Six Other Songs by Hopi Chanters [CD],Smithsonian Folkways Recordings ,New York,,Track 14,2001,,,,,,,,,,18,,,Dance,,,,,Transcriptions/xml_raw/NHSDiscography-110.xml,xml,1f2f72d77580bd65e9cd727e8fa23d9a
NHSDiscography-111,Sleep song,,"Northeastern Arizona/Northwestern New Mexico, USA",36.05,-106.07,Hopi,1950,,,"""Sleep song"" [Track 8]. On A Cry from the Earth: Music of the North American Indians [CD]. New York: Smithsonian Folkways Recordings (2001)",,,On A Cry from the Earth: Music of the North American Indians [CD],Smithsonian Folkways Recordings ,New York,,Track 8,2001,,,,,,,,,,10,,,Lullaby,,,,,Transcriptions/xml_raw/NHSDiscography-111.xml,xml,d272cf11a9bba7bfa0ad508fde3a2212
NHSDiscography-112,Séance de guérison magique,,"Otavalo, Ecuador",0.2354,-78.2616,Otavalo Quichua,pre-1960,,,"""Séance de guérison magique"" [Side B, Track 2-3]. On Equateur: Indiens Jivaro, Cayapa, Otavalo [LP]. Paris: Vogue Contrepoint (1960)",,,"On Equateur: Indiens Jivaro, Cayapa, Otavalo [LP]",Vogue Contrepoint ,Paris,,"Side B, Track 2-3",1960,,,,,,,,,,9,,,Healing,,,,,Transcriptions/xml_raw/NHSDiscography-112.xml,xml,0ae7fa0f21dc7306ab21e70abe85d112
NHSDiscography-113,Traditional doctor's cure,,"Nkoko, Uganda",0.960551,31.431355,Ganda,1970,,,"""Traditional doctor's cure"" [Track 7]. On Uganda and Other African Nations: Feasts of the Savanna: Feasts of the Savanna: A Musical Journey through East and West Africa [CD]. Barre, VT: Multicultural Media (1997)",,,On Uganda and Other African Nations: Feasts of the Savanna: Feasts of the Savanna: A Musical Journey through East and West Africa [CD],Multicultural Media ,"Barre, VT",,Track 7,1997,,,,,,,,,,9,,,Healing,,,,,Transcriptions/xml_raw/NHSDiscography-113.xml,xml,6f823a529885aa286288b1f5a1d22976
NHSDiscography-114,Cradle song,,"Falalop, Woleai, Yap, Federated States of Micronesia",7.37555559999999,143.913888899999,Yapese,1984,,,"""Cradle song"" [Track 31]. On Spirit of Micronesia [CD]. (1995). Great Britain: Saydisc Records (1995)",,,On Spirit of Micronesia [CD],Saydisc Records ,(1995). Great Britain,,Track 31,1995,,,,,,,,,,8,,,Lullaby,,,,,Transcriptions/xml_raw/NHSDiscography-114.xml,xml,f790ed781e5c9b9007dc1a60497abe67
NHSDiscography-115,Baile del venado: El palo verde,,"Vicam, Sonora, Mexico",27.644448399999998,-110.2956136,Yaqui,1946,,,"""Baile del venado: El palo verde"" [Side 1, Track 10]. On Folk Music of Mexico [LP]. Washington, D.C.: Library of Congress (1959)",,,On Folk Music of Mexico [LP],Library of Congress ,"Washington, D.C.",,"Side 1, Track 10",1959,,,,,,,,,,14,,,Dance,,,,,Transcriptions/xml_raw/NHSDiscography-115.xml,xml,a7cdfa0acf7f55f74aad48438c4bc174
NHSDiscography-116,Curative song,,"Ituri Forest, Gombari District, Congo",1.5571,28.4491,Mbuti,1952,,,"""Curative song"" [Side B, Track 9]. On TR-125: Sons d' Afrique (Congo Mbuti/Pygmy) [LP]. Johannesburg: International Library of African Music (1952)",,,On TR-125: Sons d' Afrique (Congo Mbuti/Pygmy) [LP],International Library of African Music ,Johannesburg,,"Side B, Track 9",1952,,,,,,,,,,19,,,Healing,,,,,Transcriptions/xml_raw/NHSDiscography-116.xml,xml,49b6a09e43c866d4cfd36633b15cecac
NHSDiscography-117,Berceuse / Lullaby,,"Phongsali Province, Laos",21.6833,102.1,Phunoi,1997-2001,,,"""Berceuse / Lullaby"" [Track 18]. On Music of Laos [CD]. Paris: Maison des Cultures du Monde (2004)",,,On Music of Laos [CD],Maison des Cultures du Monde ,Paris,,Track 18,2004,,,,,,,,,,17,,,Lullaby,,,,,Transcriptions/xml_raw/NHSDiscography-117.xml,xml,dc2f00960efccaf680902ed4df6ea8fa
NHSDiscography-118,I didn't care,,"Navajo Nation Reservation, USA",36.067217299999996,-109.18800469999901,Navajo,1952-1963,,,"""I didn't care"" [Track 1]. On Traditional Navajo Songs [CD]. Phoenix, Arizona: Canyon Records (1998)",,,On Traditional Navajo Songs [CD],Canyon Records ,"Phoenix, Arizona",,Track 1,1998,,,,,,,,,,20,,,Love,,,,,Transcriptions/xml_raw/NHSDiscography-118.xml,xml,126b9e2226026c1296ccffcc2c104000
